{"concise_reason": "The tool 'get_issue' (T04) consistently returns a 200 OK response with valid payload data but signals 'task_complete: false' and 'channel: task_incomplete' in episodes 3 and 4. The probe metadata flags 'independent_failure' and 'regression_requirements_identified'. This indicates a persistent runtime semantic drift where the tool fails to satisfy the task completion criteria despite successful HTTP execution, preventing the agent from proceeding to the 'close_issue' step.", "confidence": 0.95, "drift_category": "RSD", "evidence_refs": ["live-dd7ed5e614775cfe30e5-EV005", "live-dd7ed5e614775cfe30e5-EV011"], "location_path": "/repositories/{repo_id}/issues/{issue_id}", "location_type": "tool_response", "predicted_class": "PERSISTENT_DRIFT", "requested_probe": null, "target_tool_id": "get_issue"}
