{"concise_reason": "two independent live failures conflict with the displayed contract", "confidence": 0.95, "drift_category": "WPD", "evidence_refs": ["live-dd7ed5e614775cfe30e5-EV005", "live-dd7ed5e614775cfe30e5-EV011"], "location_path": "/paths/~1repositories~1{repo_id}~1issues~1{issue_id}~1close/post/x-preconditions", "location_type": "workflow_precondition", "predicted_class": "PERSISTENT_DRIFT", "requested_probe": {"needed": true}, "target_tool_id": "close_issue"}
