{"concise_reason": "The runtime response for 'create_issue' (EV005, EV011) returns an issue object with the field 'id' (value 105), whereas the displayed specification defines the 'Issue' schema with the required field 'issue_id'. This structural mismatch in the response payload constitutes a Response Schema Drift (RSD), causing the agent to fail to consume the canonical identifier as instructed.", "confidence": 0.95, "drift_category": "RSD", "evidence_refs": ["live-3aa4caf10497d7702f21-EV005", "live-3aa4caf10497d7702f21-EV011"], "location_path": "#/components/schemas/IssueSuccess", "location_type": "response_schema", "predicted_class": "PERSISTENT_DRIFT", "requested_probe": null, "target_tool_id": "create_issue"}
